No.     Time           Source                Destination           Protocol Length Info
    137 40.781216      192.168.1.5           172.217.16.14         HTTP     615    POST /collect HTTP/1.1 

Frame 137: 615 bytes on wire (4920 bits), 615 bytes captured (4920 bits) on interface \Device\NPF_{FC5B5DEF-0FBC-4521-ABA0-ED2648F4FD10}, id 0
Ethernet II, Src: AzureWav_25:f4:61 (74:c6:3b:25:f4:61), Dst: zte_c1:0b:bc (18:44:e6:c1:0b:bc)
Internet Protocol Version 4, Src: 192.168.1.5, Dst: 172.217.16.14
Transmission Control Protocol, Src Port: 50365, Dst Port: 80, Seq: 1, Ack: 1, Len: 561
Hypertext Transfer Protocol

No.     Time           Source                Destination           Protocol Length Info
    142 40.840759      172.217.16.14         192.168.1.5           HTTP     446    HTTP/1.1 200 OK  (GIF89a)

Frame 142: 446 bytes on wire (3568 bits), 446 bytes captured (3568 bits) on interface \Device\NPF_{FC5B5DEF-0FBC-4521-ABA0-ED2648F4FD10}, id 0
Ethernet II, Src: zte_c1:0b:bc (18:44:e6:c1:0b:bc), Dst: AzureWav_25:f4:61 (74:c6:3b:25:f4:61)
Internet Protocol Version 4, Src: 172.217.16.14, Dst: 192.168.1.5
Transmission Control Protocol, Src Port: 80, Dst Port: 50365, Seq: 1, Ack: 562, Len: 392
Hypertext Transfer Protocol
Compuserve GIF, Version: GIF89a

No.     Time           Source                Destination           Protocol Length Info
    285 45.861240      192.168.1.5           172.217.16.14         HTTP     626    POST /collect HTTP/1.1 

Frame 285: 626 bytes on wire (5008 bits), 626 bytes captured (5008 bits) on interface \Device\NPF_{FC5B5DEF-0FBC-4521-ABA0-ED2648F4FD10}, id 0
Ethernet II, Src: AzureWav_25:f4:61 (74:c6:3b:25:f4:61), Dst: zte_c1:0b:bc (18:44:e6:c1:0b:bc)
Internet Protocol Version 4, Src: 192.168.1.5, Dst: 172.217.16.14
Transmission Control Protocol, Src Port: 50369, Dst Port: 80, Seq: 1, Ack: 1, Len: 572
Hypertext Transfer Protocol

No.     Time           Source                Destination           Protocol Length Info
    286 45.861999      192.168.1.5           172.217.16.14         HTTP     626    POST /collect HTTP/1.1 

Frame 286: 626 bytes on wire (5008 bits), 626 bytes captured (5008 bits) on interface \Device\NPF_{FC5B5DEF-0FBC-4521-ABA0-ED2648F4FD10}, id 0
Ethernet II, Src: AzureWav_25:f4:61 (74:c6:3b:25:f4:61), Dst: zte_c1:0b:bc (18:44:e6:c1:0b:bc)
Internet Protocol Version 4, Src: 192.168.1.5, Dst: 172.217.16.14
Transmission Control Protocol, Src Port: 50370, Dst Port: 80, Seq: 1, Ack: 1, Len: 572
Hypertext Transfer Protocol

No.     Time           Source                Destination           Protocol Length Info
    287 45.862375      192.168.1.5           172.217.16.14         HTTP     628    POST /collect HTTP/1.1 

Frame 287: 628 bytes on wire (5024 bits), 628 bytes captured (5024 bits) on interface \Device\NPF_{FC5B5DEF-0FBC-4521-ABA0-ED2648F4FD10}, id 0
Ethernet II, Src: AzureWav_25:f4:61 (74:c6:3b:25:f4:61), Dst: zte_c1:0b:bc (18:44:e6:c1:0b:bc)
Internet Protocol Version 4, Src: 192.168.1.5, Dst: 172.217.16.14
Transmission Control Protocol, Src Port: 50371, Dst Port: 80, Seq: 1, Ack: 1, Len: 574
Hypertext Transfer Protocol

No.     Time           Source                Destination           Protocol Length Info
    288 45.862647      192.168.1.5           172.217.16.14         HTTP     626    POST /collect HTTP/1.1 

Frame 288: 626 bytes on wire (5008 bits), 626 bytes captured (5008 bits) on interface \Device\NPF_{FC5B5DEF-0FBC-4521-ABA0-ED2648F4FD10}, id 0
Ethernet II, Src: AzureWav_25:f4:61 (74:c6:3b:25:f4:61), Dst: zte_c1:0b:bc (18:44:e6:c1:0b:bc)
Internet Protocol Version 4, Src: 192.168.1.5, Dst: 172.217.16.14
Transmission Control Protocol, Src Port: 50373, Dst Port: 80, Seq: 1, Ack: 1, Len: 572
Hypertext Transfer Protocol

No.     Time           Source                Destination           Protocol Length Info
    289 45.862928      192.168.1.5           172.217.16.14         HTTP     611    POST /collect HTTP/1.1 

Frame 289: 611 bytes on wire (4888 bits), 611 bytes captured (4888 bits) on interface \Device\NPF_{FC5B5DEF-0FBC-4521-ABA0-ED2648F4FD10}, id 0
Ethernet II, Src: AzureWav_25:f4:61 (74:c6:3b:25:f4:61), Dst: zte_c1:0b:bc (18:44:e6:c1:0b:bc)
Internet Protocol Version 4, Src: 192.168.1.5, Dst: 172.217.16.14
Transmission Control Protocol, Src Port: 50372, Dst Port: 80, Seq: 1, Ack: 1, Len: 557
Hypertext Transfer Protocol

No.     Time           Source                Destination           Protocol Length Info
    290 45.863211      192.168.1.5           172.217.16.14         HTTP     626    POST /collect HTTP/1.1 

Frame 290: 626 bytes on wire (5008 bits), 626 bytes captured (5008 bits) on interface \Device\NPF_{FC5B5DEF-0FBC-4521-ABA0-ED2648F4FD10}, id 0
Ethernet II, Src: AzureWav_25:f4:61 (74:c6:3b:25:f4:61), Dst: zte_c1:0b:bc (18:44:e6:c1:0b:bc)
Internet Protocol Version 4, Src: 192.168.1.5, Dst: 172.217.16.14
Transmission Control Protocol, Src Port: 50374, Dst Port: 80, Seq: 1, Ack: 1, Len: 572
Hypertext Transfer Protocol

No.     Time           Source                Destination           Protocol Length Info
    291 45.863499      192.168.1.5           172.217.16.14         HTTP     628    POST /collect HTTP/1.1 

Frame 291: 628 bytes on wire (5024 bits), 628 bytes captured (5024 bits) on interface \Device\NPF_{FC5B5DEF-0FBC-4521-ABA0-ED2648F4FD10}, id 0
Ethernet II, Src: AzureWav_25:f4:61 (74:c6:3b:25:f4:61), Dst: zte_c1:0b:bc (18:44:e6:c1:0b:bc)
Internet Protocol Version 4, Src: 192.168.1.5, Dst: 172.217.16.14
Transmission Control Protocol, Src Port: 50375, Dst Port: 80, Seq: 1, Ack: 1, Len: 574
Hypertext Transfer Protocol

No.     Time           Source                Destination           Protocol Length Info
    297 45.922951      172.217.16.14         192.168.1.5           HTTP     446    HTTP/1.1 200 OK  (GIF89a)

Frame 297: 446 bytes on wire (3568 bits), 446 bytes captured (3568 bits) on interface \Device\NPF_{FC5B5DEF-0FBC-4521-ABA0-ED2648F4FD10}, id 0
Ethernet II, Src: zte_c1:0b:bc (18:44:e6:c1:0b:bc), Dst: AzureWav_25:f4:61 (74:c6:3b:25:f4:61)
Internet Protocol Version 4, Src: 172.217.16.14, Dst: 192.168.1.5
Transmission Control Protocol, Src Port: 80, Dst Port: 50369, Seq: 1, Ack: 573, Len: 392
Hypertext Transfer Protocol
Compuserve GIF, Version: GIF89a

No.     Time           Source                Destination           Protocol Length Info
    300 45.924690      172.217.16.14         192.168.1.5           HTTP     446    HTTP/1.1 200 OK  (GIF89a)

Frame 300: 446 bytes on wire (3568 bits), 446 bytes captured (3568 bits) on interface \Device\NPF_{FC5B5DEF-0FBC-4521-ABA0-ED2648F4FD10}, id 0
Ethernet II, Src: zte_c1:0b:bc (18:44:e6:c1:0b:bc), Dst: AzureWav_25:f4:61 (74:c6:3b:25:f4:61)
Internet Protocol Version 4, Src: 172.217.16.14, Dst: 192.168.1.5
Transmission Control Protocol, Src Port: 80, Dst Port: 50370, Seq: 1, Ack: 573, Len: 392
Hypertext Transfer Protocol
Compuserve GIF, Version: GIF89a

No.     Time           Source                Destination           Protocol Length Info
    304 45.933657      172.217.16.14         192.168.1.5           HTTP     446    HTTP/1.1 200 OK  (GIF89a)

Frame 304: 446 bytes on wire (3568 bits), 446 bytes captured (3568 bits) on interface \Device\NPF_{FC5B5DEF-0FBC-4521-ABA0-ED2648F4FD10}, id 0
Ethernet II, Src: zte_c1:0b:bc (18:44:e6:c1:0b:bc), Dst: AzureWav_25:f4:61 (74:c6:3b:25:f4:61)
Internet Protocol Version 4, Src: 172.217.16.14, Dst: 192.168.1.5
Transmission Control Protocol, Src Port: 80, Dst Port: 50371, Seq: 1, Ack: 575, Len: 392
Hypertext Transfer Protocol
Compuserve GIF, Version: GIF89a

No.     Time           Source                Destination           Protocol Length Info
    307 45.934422      172.217.16.14         192.168.1.5           HTTP     446    HTTP/1.1 200 OK  (GIF89a)

Frame 307: 446 bytes on wire (3568 bits), 446 bytes captured (3568 bits) on interface \Device\NPF_{FC5B5DEF-0FBC-4521-ABA0-ED2648F4FD10}, id 0
Ethernet II, Src: zte_c1:0b:bc (18:44:e6:c1:0b:bc), Dst: AzureWav_25:f4:61 (74:c6:3b:25:f4:61)
Internet Protocol Version 4, Src: 172.217.16.14, Dst: 192.168.1.5
Transmission Control Protocol, Src Port: 80, Dst Port: 50373, Seq: 1, Ack: 573, Len: 392
Hypertext Transfer Protocol
Compuserve GIF, Version: GIF89a

No.     Time           Source                Destination           Protocol Length Info
    311 45.939337      172.217.16.14         192.168.1.5           HTTP     446    HTTP/1.1 200 OK  (GIF89a)

Frame 311: 446 bytes on wire (3568 bits), 446 bytes captured (3568 bits) on interface \Device\NPF_{FC5B5DEF-0FBC-4521-ABA0-ED2648F4FD10}, id 0
Ethernet II, Src: zte_c1:0b:bc (18:44:e6:c1:0b:bc), Dst: AzureWav_25:f4:61 (74:c6:3b:25:f4:61)
Internet Protocol Version 4, Src: 172.217.16.14, Dst: 192.168.1.5
Transmission Control Protocol, Src Port: 80, Dst Port: 50372, Seq: 1, Ack: 558, Len: 392
Hypertext Transfer Protocol
Compuserve GIF, Version: GIF89a

No.     Time           Source                Destination           Protocol Length Info
    314 45.944389      172.217.16.14         192.168.1.5           HTTP     446    HTTP/1.1 200 OK  (GIF89a)

Frame 314: 446 bytes on wire (3568 bits), 446 bytes captured (3568 bits) on interface \Device\NPF_{FC5B5DEF-0FBC-4521-ABA0-ED2648F4FD10}, id 0
Ethernet II, Src: zte_c1:0b:bc (18:44:e6:c1:0b:bc), Dst: AzureWav_25:f4:61 (74:c6:3b:25:f4:61)
Internet Protocol Version 4, Src: 172.217.16.14, Dst: 192.168.1.5
Transmission Control Protocol, Src Port: 80, Dst Port: 50374, Seq: 1, Ack: 573, Len: 392
Hypertext Transfer Protocol
Compuserve GIF, Version: GIF89a

No.     Time           Source                Destination           Protocol Length Info
    317 45.948741      172.217.16.14         192.168.1.5           HTTP     446    HTTP/1.1 200 OK  (GIF89a)

Frame 317: 446 bytes on wire (3568 bits), 446 bytes captured (3568 bits) on interface \Device\NPF_{FC5B5DEF-0FBC-4521-ABA0-ED2648F4FD10}, id 0
Ethernet II, Src: zte_c1:0b:bc (18:44:e6:c1:0b:bc), Dst: AzureWav_25:f4:61 (74:c6:3b:25:f4:61)
Internet Protocol Version 4, Src: 172.217.16.14, Dst: 192.168.1.5
Transmission Control Protocol, Src Port: 80, Dst Port: 50375, Seq: 1, Ack: 575, Len: 392
Hypertext Transfer Protocol
Compuserve GIF, Version: GIF89a

No.     Time           Source                Destination           Protocol Length Info
    802 80.377391      192.168.1.5           172.217.16.14         HTTP     670    POST /collect HTTP/1.1 

Frame 802: 670 bytes on wire (5360 bits), 670 bytes captured (5360 bits) on interface \Device\NPF_{FC5B5DEF-0FBC-4521-ABA0-ED2648F4FD10}, id 0
Ethernet II, Src: AzureWav_25:f4:61 (74:c6:3b:25:f4:61), Dst: zte_c1:0b:bc (18:44:e6:c1:0b:bc)
Internet Protocol Version 4, Src: 192.168.1.5, Dst: 172.217.16.14
Transmission Control Protocol, Src Port: 50384, Dst Port: 80, Seq: 1, Ack: 1, Len: 616
Hypertext Transfer Protocol

No.     Time           Source                Destination           Protocol Length Info
    807 80.418996      192.168.1.5           172.217.16.14         HTTP     612    POST /collect HTTP/1.1 

Frame 807: 612 bytes on wire (4896 bits), 612 bytes captured (4896 bits) on interface \Device\NPF_{FC5B5DEF-0FBC-4521-ABA0-ED2648F4FD10}, id 0
Ethernet II, Src: AzureWav_25:f4:61 (74:c6:3b:25:f4:61), Dst: zte_c1:0b:bc (18:44:e6:c1:0b:bc)
Internet Protocol Version 4, Src: 192.168.1.5, Dst: 172.217.16.14
Transmission Control Protocol, Src Port: 50385, Dst Port: 80, Seq: 1, Ack: 1, Len: 558
Hypertext Transfer Protocol

No.     Time           Source                Destination           Protocol Length Info
    808 80.437083      172.217.16.14         192.168.1.5           HTTP     446    HTTP/1.1 200 OK  (GIF89a)

Frame 808: 446 bytes on wire (3568 bits), 446 bytes captured (3568 bits) on interface \Device\NPF_{FC5B5DEF-0FBC-4521-ABA0-ED2648F4FD10}, id 0
Ethernet II, Src: zte_c1:0b:bc (18:44:e6:c1:0b:bc), Dst: AzureWav_25:f4:61 (74:c6:3b:25:f4:61)
Internet Protocol Version 4, Src: 172.217.16.14, Dst: 192.168.1.5
Transmission Control Protocol, Src Port: 80, Dst Port: 50384, Seq: 1, Ack: 617, Len: 392
Hypertext Transfer Protocol
Compuserve GIF, Version: GIF89a

No.     Time           Source                Destination           Protocol Length Info
    814 80.477717      172.217.16.14         192.168.1.5           HTTP     446    HTTP/1.1 200 OK  (GIF89a)

Frame 814: 446 bytes on wire (3568 bits), 446 bytes captured (3568 bits) on interface \Device\NPF_{FC5B5DEF-0FBC-4521-ABA0-ED2648F4FD10}, id 0
Ethernet II, Src: zte_c1:0b:bc (18:44:e6:c1:0b:bc), Dst: AzureWav_25:f4:61 (74:c6:3b:25:f4:61)
Internet Protocol Version 4, Src: 172.217.16.14, Dst: 192.168.1.5
Transmission Control Protocol, Src Port: 80, Dst Port: 50385, Seq: 1, Ack: 559, Len: 392
Hypertext Transfer Protocol
Compuserve GIF, Version: GIF89a
