No.     Time           Source                Destination           Protocol Length Info
    130 7.623632       192.168.1.5           66.6.101.171          HTTP     568    GET /dyn/str_strip/000000000/00000000/0000000/000000/70000/3000 HTTP/1.1 

Frame 130: 568 bytes on wire (4544 bits), 568 bytes captured (4544 bits) on interface \Device\NPF_{FC5B5DEF-0FBC-4521-ABA0-ED2648F4FD10}, id 0
Ethernet II, Src: AzureWav_25:f4:61 (74:c6:3b:25:f4:61), Dst: zte_c1:0b:bc (18:44:e6:c1:0b:bc)
Internet Protocol Version 4, Src: 192.168.1.5, Dst: 66.6.101.171
Transmission Control Protocol, Src Port: 53015, Dst Port: 80, Seq: 1, Ack: 1, Len: 514
Hypertext Transfer Protocol

No.     Time           Source                Destination           Protocol Length Info
    145 7.794151       66.6.101.171          192.168.1.5           HTTP     241    HTTP/1.1 301 Moved Permanently 

Frame 145: 241 bytes on wire (1928 bits), 241 bytes captured (1928 bits) on interface \Device\NPF_{FC5B5DEF-0FBC-4521-ABA0-ED2648F4FD10}, id 0
Ethernet II, Src: zte_c1:0b:bc (18:44:e6:c1:0b:bc), Dst: AzureWav_25:f4:61 (74:c6:3b:25:f4:61)
Internet Protocol Version 4, Src: 66.6.101.171, Dst: 192.168.1.5
Transmission Control Protocol, Src Port: 80, Dst Port: 53015, Seq: 1, Ack: 515, Len: 187
Hypertext Transfer Protocol
