No.     Time           Source                Destination           Protocol Length Info
     59 15.847516      192.168.1.5           128.119.245.12        HTTP     552    GET /wireshark-labs/HTTP-wireshark-file1.html HTTP/1.1 

Frame 59: 552 bytes on wire (4416 bits), 552 bytes captured (4416 bits) on interface \Device\NPF_{FC5B5DEF-0FBC-4521-ABA0-ED2648F4FD10}, id 0
Ethernet II, Src: AzureWav_25:f4:61 (74:c6:3b:25:f4:61), Dst: zte_c1:0b:bc (18:44:e6:c1:0b:bc)
Internet Protocol Version 4, Src: 192.168.1.5, Dst: 128.119.245.12
Transmission Control Protocol, Src Port: 52860, Dst Port: 80, Seq: 1, Ack: 1, Len: 498
Hypertext Transfer Protocol

No.     Time           Source                Destination           Protocol Length Info
     61 15.991953      128.119.245.12        192.168.1.5           HTTP     540    HTTP/1.1 200 OK  (text/html)

Frame 61: 540 bytes on wire (4320 bits), 540 bytes captured (4320 bits) on interface \Device\NPF_{FC5B5DEF-0FBC-4521-ABA0-ED2648F4FD10}, id 0
Ethernet II, Src: zte_c1:0b:bc (18:44:e6:c1:0b:bc), Dst: AzureWav_25:f4:61 (74:c6:3b:25:f4:61)
Internet Protocol Version 4, Src: 128.119.245.12, Dst: 192.168.1.5
Transmission Control Protocol, Src Port: 80, Dst Port: 52860, Seq: 1, Ack: 499, Len: 486
Hypertext Transfer Protocol
Line-based text data: text/html (4 lines)

